sent_rating,processed_text_KeepStopwords,data
positivo,A mídia não pôde ser carregada Simplesmente perfeita Melhor assistente Reconhece a voz mesmo falando baixo Não precisa gritar para chamar ela E a variedade imensa de coisas que ela pode fazer surpreende,2021-06-26 00:00:00
positivo,Já conhecia o produto comprei para dar de presente Tudo de bom,2021-12-18 00:00:00
positivo,Muito bom pra ouvir música e podcast,2021-10-17 00:00:00
positivo,Possuo os dois modelos o de 3a e 4a geração e percebi que a de 4a é um pouco mais lenta que a antiga E tbm tive dificuldades de parear ela com minha SmartTV Mas o som é muito bom,2021-06-14 00:00:00
positivo,Não tenho nada o que reclamar sobre a Alexa a única coisa que a Amazon poderia fazer é um carregador portátil pra poder levar ela para todos os lugares sem ter medo de não ter tomadas,2021-04-16 00:00:00
negativo,Eu esperava mais do produto Não reconhece a maioria das músicas solicitadas o som nao é tao limpo e potente qto anunciado Não estou completamente satisfeita com o produto,2022-01-26 00:00:00
positivo,Produto muito bom mas sempre tem margem p melhora ex quando se pede uma musica ou cantor e se perde entendendo outra musica ou cantor mas da tranquilo p dar nota 8.8 tranquilo no conjunto todo,2021-09-21 00:00:00
positivo,Ela é perfeita sensacional simplesmente maravilhosa,2020-12-31 00:00:00
positivo,Excelente para ouvir músicas ou podcastsA inteligência artificial é bem razoável e da alguns momentos de diversão,2021-05-23 00:00:00
positivo,A configuração é fácil E é bem útil,2021-06-30 00:00:00
negativo,Gostei do dezaine mais ouvia fala que ela era surda e e verdade tem muita dificuldade de entender A anterior que eu tenho da de 10 a 0,2021-01-07 00:00:00
positivo,Alexa é muito bom e bastante útil pra automação residencial recomendo Poderia ter algumas funções que tem em outras regiões no Brasil também,2021-06-29 00:00:00
positivo,Estou adorando Para mim a melhor função é vc comndar por voz buscar músicas enquanto trabalha Nota 10,2020-12-04 00:00:00
positivo,Gostei do produto excelente design versátil ótima experiência de interação por voz e boa qualidade de conteúdo Todavia a qualidade do som deixa a desejar,2021-12-16 00:00:00
positivo,Produto sem igual reconhecimento de voz excelente até a longas distâncias O dispositivo também é muito inteligente praticamente conversa com o usuário,2022-03-16 00:00:00
positivo,Um ótimo produto para te acompanhar nas tarefas do dia a dia Acredito que com complementos como a casa conectada e outras skills cada vez ele será muito útil,2020-12-28 00:00:00
positivo,Gostei muito do produto várias funcionalidades única coisa a melhorar é habilitar pra reconhecer a voz apenas de pessoas cadastradas por ex para abrir fechaduras com segurança,2021-12-22 00:00:00
positivo,A nova Alexa é muito boa por mais que às vezes tenha alguma dificuldade de me escutar não é nada que me atrapalhe Qualidade sonora muito superior ao modelo passado,2021-03-14 00:00:00
positivo,A experiência que estou tendo com a echo esta sendo muito boa ainda tenho problemas pra fazer algumas skills infantis mais ate o momento esta sendo tudo satisfatório,2021-05-24 00:00:00
positivo,Até o que testei tudo ótimo,2020-12-07 00:00:00
positivo,Uma grata surpresa pois não esperava tanta qualidade em um produto tão pequeno Um ótimo presente dado a minha esposa Ficou muito feliz e está usando muito,2021-07-05 00:00:00
positivo,A qualidade de som deixa a desejar em relação a echo dot 3 Pois esta de 4ª geração faz um chiado quando responde algo Não são todas as vezes porém isso me deixa um pouco insatisfeito,2021-04-12 00:00:00
positivo,Gostei muito do som e reconhecimento de voz a entrega também foi super rápida Para ficar perfeito só faltou que mais marcas de aparelhos eletrônicos estivessem nas opções de escolha,2020-12-01 00:00:00
positivo,Meu celular demorou para conectar mas o problema não foi com ela e sim com o celular quando troquei de celular para fazer a configuração deu tudo certo Está funcionando perfeitamente,2021-07-08 00:00:00
positivo,Excepcional dispositivo Superou todas as minhas expectativas Para ser melhor só faltava ser recarregáveis ao invés de ficar conectado na tomada Já estou pensando em comprar mais um,2020-12-18 00:00:00
negativo,Eu tinha pesquisado o echo dot com o relógio E aí apareceu a sugestão deste produto Preciso de um com o relógio Me diz como proceder para fazer essa troca Obrigado,2021-05-28 00:00:00
positivo,A qualidade do som é ótima Material de boa qualidade e com um bom design Os problemas reconhece a voz de outras pessoas além da minha fica se desconectado do Wi-Fi Acredito que deveria ter uma bateria pois só funciona na tomada,2021-02-18 00:00:00
negativo,Muito boa qualidade tudo estaria conforme se não fosse um detalhe extremamente importante Só FUNCIONA CONECTADA NA TOMADA 🏻‍ ️,2020-12-02 00:00:00
negativo,Eu configurei na minha casa e funcionou legal levei na casa da minha amiga pra mostrar pra ela perdi uma hora tentando configurar e n consegui voltei pra casa e minha alexa n configura mais em casa tbm,2020-12-26 00:00:00
positivo,Perfeito chegou um dia antes da data marcada!Qualidade do som impecável vi muitas pessoas dizendo que a 4 ° geração tinha um pouco de dificuldade de ouvir mas a minha ouve perfeitamente,2021-07-21 00:00:00
positivo,SIMPLESMENTE O PRODUTO É MUITO BOM SÓ QUE ELE DEU PAU EM MENOS DE 6 MESES DE USO E A AMAZON ESTÁ ME ENROLANDO A PELO MENOS 3 MESES E ATÉ AGORA NADA DE FAZEREM A TROCA PÉSSIMO SUPORTE TÉCNICO,2021-08-31 00:00:00
positivo,A nova echo dot 4 é um máximo muito bonita e de alta qualidade seu reconhecimento de voz não deixa a desejar em nada só o app pra iOS que é meio bosta mais nada que uma futura att não resolva,2021-07-19 00:00:00
positivo,Ótima qualidade de microfone para reconhecimento de voz Ótimo auxílio para deficientes visuais pois sou deficiente visual e Alexa ajuda bastante vale a pena também a qualidade do som é muito boa,2021-07-26 00:00:00
positivo,O áudio funciona muito bem o reconhecimento de voz tbm para quem tem ou pretende ter outros itens de casa inteligente ajuda muito mas tbm tem bastante utilidade para quem não tem esses itens,2021-12-27 00:00:00
positivo,Muito bom atende as expectativasO único problema é que tem de estar plugado na tomada,2022-01-02 00:00:00
positivo,De vez em quando ela trava!Os comandos são todos direcionados ao Amazon music as vezes pedimos uma música específica no Spotify ela fala que não tem como só se for no Amazon,2021-07-13 00:00:00
negativo,Alexa não responde os comandos direito parece que não ouve mesmo falando a curta distância A internet está com a conexão excelente Já fiz todos os comando indicados já desinstalei e instalei aplicativo Me decepcionei,2020-12-29 00:00:00
positivo,Eu gostei muito do produto Foi uma das melhores compras que eu já fiz Eu uso bastante a minha echo dot 4 para ouvir música como assistente pessoal e para automação residencial,2021-02-04 00:00:00
negativo,Não oferece interação com o fire tv no YouTube que era a minha intenção acabei me desfazendo dele no fim achei inútil quando se trata de utilizá-lo com outros produtos da própria Amazon,2021-01-01 00:00:00
positivo,As vezes não reconhece comandos basicos,2021-03-06 00:00:00
positivo,Muito boa qualidade de som e reprodução A captação de voz é impecável e pra que está buscando entretenimento super recomendo,2021-12-06 00:00:00
positivo,Ao contrário do que dizem esse modelo não apresenta dificuldades em nos ouvir não é surda Ela me ouve de outro cômodo e com a TV ligada sem necessidade de gritar,2021-03-22 00:00:00
negativo,Muito baixo a potência de som,2021-09-14 00:00:00
positivo,A minha filha adorou estamos ainda descobrindo e explorando como utilizar melhor a Alexa,2021-07-04 00:00:00
positivo,A qualidade de som é ótima os comandos são respondidos prontamente tem uma capacidade de escuta apliada quando o aplicativa está corretamente configurado pelo celular,2021-03-08 00:00:00
positivo,Ainda temMuito o que atualizar mas até agora tem respondido as minhas expectativas Falta eu comprar os itens pra terminar deConectar a minha casa,2021-07-29 00:00:00
positivo,O aparelho é incrível o reconhecimento de voz é muito bom A qualidade do som é incrível Podia ter uma separação melhor dos perfis de voz,2020-12-23 00:00:00
positivo,Som bom reconhece bem os comandos e tem boas funcionalidades,2021-08-18 00:00:00
positivo,Ótima Pra quem gosta de uma caixinha de som inteligente ela é mto mais do que isto Vale mto à pena Recomendo,2021-07-10 00:00:00
positivo,Superou todas as minhas expectativas não achei que seria como é parabéns a Amazon única dica é fazer uma bateria feita pela Amazon mesmo que seja separadopara poder movimentar a Alexa,2020-12-04 00:00:00
positivo,o produto é ótimo só fiquei triste por estar em sua quarta geração e ser dependente do fio espero que com o tempo evolua pra um produto sem fio e recarregável fora isso absurdo de bom,2021-01-07 00:00:00
negativo,Não vi vantagem em relação à 3ªgeração Muitas vezes falha em ouvir sua voz,2021-03-27 00:00:00
positivo,Eu vi algumas reclamações que ela tem dificuldade em ouvir os comandos mas a minha veio 100 escuta muito bem a minha voz até de longe funciona bem estou satisfeito com a minha compra,2021-12-03 00:00:00
positivo,Excelente produto tem momentos que ela não escuta vc chamando pelo menos para mim não é um grande problema eu dou até risada e chamo ela de surda,2021-06-30 00:00:00
positivo,Produto de ótima qualidade valeu cada centavo gasto O reconhecimento de voz é excelente e as coisas que vc pode fazer com ela são várias,2021-10-21 00:00:00
positivo,Reconhece somente músicas mais conhecidas pensei também que tinha um led relógio depois descobri que não era com o led e que o mesmo produto com led custa 200 a mais!Poderia ter pelo menos uns 5W,2021-01-27 00:00:00
positivo,Todas as funções são maravilhosas Lembrete Alarme Lista de compras Comandos de ligar e desligar Tocar música Ligar tv Simplesmente maravilhosa Som espetacular Comprarei mais duas,2021-06-01 00:00:00
positivo,Ótima Echo Dot uso como caixa de som para o pc usando o bluetooth como caixa de som para ouvir musicas com o Spotify e a melhor assistente de voz que existe Alexa,2022-02-16 00:00:00
positivo,Produto muito bom porém achei que tem horas que ele não me escuta no mais é perfeito,2021-06-29 00:00:00
positivo,Virou minha melhor amiga Como ajuda na rotina,2020-11-30 00:00:00
positivo,Gostei do produto o reconhecimento de voz funciona muito bem a qualidade do som também é bem boa.o aplicativo poderia ter mais recursos mas acredito que com o tempo vai melhorar,2021-07-15 00:00:00
positivo,A mídia não pôde ser carregada Ótimo produto pelo valor pago ajuda muito em lembretes e rotinas fora que toca músicas de várias estações muito bom mesmo,2021-07-23 00:00:00
positivo,A mídia não pôde ser carregada Sem palavras pra descrever a ecodotch Alexa perfeita maravilhosa espetacular agora pretendo comprar os acessórios pra minha Alexa Recomendo ️ ️ ️ ️,2021-03-04 00:00:00
positivo,Bom produto Qualidade excelente de acabamento Sensibilidade do microfone é muito boa A vantagem com relação a versão é o novo chipset integrado,2021-01-11 00:00:00
positivo,Muito boa Boa qualidade de som reconhece bem a voz,2021-03-07 00:00:00
positivo,A caixinha é bacana corresponde ao que promete e tem um som alto e de qualidade se formos olhar pelo tamanho Recomendo para quem gosta de ouvir músicas deitado de boa na lagoa,2021-06-16 00:00:00
positivo,So não dou 5 estrelas porque ela nao Alcança comandos com longa distância e algumas vezes tenho que repetir várias vezes Mas o som é excelente design moderno e muito prática,2022-01-08 00:00:00
positivo,Já tinha o Novo Echo Dot 3 agora o de 4ª geração tambémgostei de ambos aparelhos,2020-12-12 00:00:00
positivo,O produto é muito Bom e prático tenho as informações na hora gosto de acompanhar jogos de futebol no rádio e com a alexa tenho todas as rádios online de forma muito prática,2021-01-03 00:00:00
positivo,Estou gostando muito Gente vale muito a pena,2020-11-12 00:00:00
positivo,Já não vivemos sem uma maravilhosa decisão Nós ajuda muito excelente para ouvir música e auxiliar no dia a dia,2021-05-15 00:00:00
positivo,Produto de muita qualidade bem construído Utilizo no quarto como speaker e o som dele realmente é de qualidade principalmente para assistir filmes em um volume moderado,2021-06-22 00:00:00
positivo,Ainda estou me acostumando com o produto não avaliei todo potencial dele Mas o que precisei usar até o momento me deixou satisfeito,2021-07-08 00:00:00
positivo,Produto de excelente qualidade e rápida wntrega,2021-12-29 00:00:00
positivo,Minha assistente pessoal preferida Alexa é a melhor que já tive oportunidade de ter Torna meu afazeres e lazer do dia-a-dia mais divertidos e eficientes,2021-01-31 00:00:00
positivo,Echo Dot 4ª geração é primeiro passo para automação da minha residência e atendeu todas minhas expectativas Excelente qualidade e o novo designe em formato de esfera ficou perfeito,2022-03-16 00:00:00
positivo,A utilidade depende de quem usa e não do dispositivo Pode usar só pra ouvir música o que já é um ótimo custo-benefício como fazer incontáveis atividades diárias basta criatividade,2021-07-15 00:00:00
positivo,Bem legal vale a pena,2021-07-30 00:00:00
positivo,A mídia não pôde ser carregada Galara minha primeira Alexa estou gostando muito eu recomendo não estou tendo problemas com os comandos ele atende super bem e rápido,2022-03-17 00:00:00
positivo,Consigo realizar funções práticas para o meu dia a dia e executar tarefas apenas por voz É muito legal recomendo,2021-12-19 00:00:00
positivo,Muito interessante vale a pena,2021-09-11 00:00:00
positivo,Nada a reclamar o reconhecimento de voz está bem melhor que a geração anterior agora ela escuta mesmo com som alto a qualidade de som também está ótima,2020-12-26 00:00:00
positivo,Comprei uma Echo Dot 4 na cor preta porém o cabo de energia que veio é branco Isso é normal Escolhi a cor preta para combinar com o local onde ela vai ficar agora ficou destoante,2021-12-19 00:00:00
positivo,Produto maravilhoso Super fácil de configurar e usar Com as diversas funcionalidades acaba facilitando o dia a dia Recomendo muito para quem ainda tem dúvidas de comprar,2021-08-11 00:00:00
positivo,Muito fácil instalação e configuração qualidade do som muito bom pras funções casa inteligente muito fácil de configurar Ela tem uma captação de comando muito boa e rápida na ação,2021-02-09 00:00:00
positivo,Sim melhor que a de 3 geração Design mais bonito,2020-11-26 00:00:00
positivo,Adorei o produto som de boa qualidade e a Alexa está facilitando demais a minha vida com os lembretes alarmes avisos,2021-07-07 00:00:00
positivo,Fiquei encantado com o equipamento são recursos inimagináveis irei comprar outra Para ser perfeita só precisava funcionar sem está ligada a energia ter bateria No mais super recomendo,2021-05-16 00:00:00
negativo,Achei a ideia bem interessante e o audio me surpreendeu entretanto em varias vezes a gente tem q gritar para ela escutar E varias rotinas que criei ela nao obedece Mesmo estando tudo configurado corretamente Uma pena,2021-01-16 00:00:00
positivo,O aplicativo permite criar umas rotinas bem legais e as skills são excelentes O aparelho possui bom material e o volume é o suficiente,2021-01-18 00:00:00
positivo,Estou amando muito prática e bonita Atende perfeitamente os comandos de voz se íntegra com meus produtos inteligentes,2020-12-07 00:00:00
negativo,Amo a Echo tenho uma e comprei esta pra dar de presente Porém achei bem feio vir um cabo branco pro produto preto não fica esteticamente bacana pra colocar na sala em lugar nenhum,2021-06-28 00:00:00
positivo,Um bom produto porém às vezes chamo e ela n escuta mesmo estando perto a qualidade do som é boa até o número 5 máximo número 6 depois disso o som perde o grave e fica só agudos e médios,2021-05-16 00:00:00
negativo,O reconhecimento de voz e fraco tem horas que não me escuta principalmente se começar a reproduzir música com vozes agudas ela funciona melhor com a echo de 3ª geração isso não ocorre,2021-03-26 00:00:00
positivo,Produto supera as expectativas Torna tudo muito prático e ajuda com seus afazeres do dia-a-dia,2021-04-22 00:00:00
positivo,Perfeito A qualidade do som é melhor que a versao anterior MAS eu prefiro 1000x o design anterior rs,2021-05-23 00:00:00
positivo,Poderia ter um som melhor mas para um escritório atende bem Ocorreu de acionar sozinho por duas vezes ainda não descobri o motivo pois todos estavam dormindo quando ocorreu,2021-01-18 00:00:00
positivo,O som é muito bom o volume consegue ir bem alto As vezes a Alexa não entende o que é dito mas é só repetir o comando Ela coxixa a noite Muito legal,2021-07-13 00:00:00
positivo,quanta praticidade ouvir livro enquanto preparo o cafe colocar para tocar rapidamente um musica q veio a minha cabeca estou adorando a experiencia,2021-03-08 00:00:00
positivo,Muito bom prático facilita a vida ajuda muito além de lembretes despertador etc e tb da pra criar rotinas muito bom mesmo recomendo Melhor custo beneficio,2021-03-08 00:00:00
positivo,É um bom produto porém comparado com a geração 3 ele perde no reconhecimento de voz Não pretendo comprar mais da geração 4 a geração 3 é mais eficiente,2021-05-29 00:00:00
positivo,Eu comprei pra escutar música e ela me atende muuuito bem economiza uma baita bateria do celular Além dessa função eu só uso como despertador o que é bastante eficiente também,2021-08-27 00:00:00
positivo,Simplesmente fantástica Ela interpreta rapidamente os camandos de voz Fascinante ela ler meus livros na biblioteca do Kindle,2021-05-08 00:00:00
negativo,Este produto adquirido me deixou na mão funcionou perfeitamente uma semana e parou Todas as tentativas para voltar a funcionar foram frustradas Preciso saber como faço,2022-03-07 00:00:00
positivo,Muitas opções de entretenimento informação e automação em casa A Alexa lê meus livros do Kindle Vale a pena,2021-07-10 00:00:00
positivo,Eu gostei bastante luz excelente designe super moderno só acho que veio com defeito a saída de som pq é torto o pino mas não sei se tem que ser assim,2021-04-17 00:00:00
positivo,Essa é a segunda que compro Dei de presente para meus sobrinhos A casa não é mesma com a Alex Super recomendo,2022-02-05 00:00:00
negativo,Produto bom mas configuração péssima Ficava dando play em vídeos e áudios automaticamente Desinstalei varias vezes mas não resolveu Tive que voltar pra caixa de som antiga com fio,2021-03-21 00:00:00
positivo,Falta de uma bateria para permitir portabilidade do produto,2021-08-04 00:00:00
positivo,Amamos aqui em casa ao contrário do que dizem não precisa gritar pra ela ouvir A Alexa te ouve em tom de voz normal Minha mãe tem 7 de visão e pra ela é uma ajuda e tanto,2021-07-14 00:00:00
positivo,Um ótimo produto smart,2021-08-08 00:00:00
positivo,Sempre tive restrições sobre esses assistentes virtuais mas experimentei para testar e agora vou colocar mais 5 na minha casa a gama de serviços e possibilidades é infinita,2021-05-27 00:00:00
positivo,Gostamos muito da Alexa aqui em casa tenho utilizado para automação de algumas lampadas entretenimento e pesquisa Super recomendo Gostamos muito do reconhecimento de voz tb,2021-01-09 00:00:00
positivo,Atendeu bem as minhas expectativas Talvez possa atender mais ainda é preciso ir atrás de algumas skills dela para não subaproveitar os seus recursos,2021-10-14 00:00:00
positivo,não consigo ver minha vida sem uma alexa hoje sou muito felize recomendo para todos meus amigos,2021-07-04 00:00:00
positivo,Qualidade de som boa compatível com o tamanho do aparelho O alcance do microfone é muito bom Ainda me familiarizando com os recursos,2021-07-08 00:00:00
positivo,Estamos amando a Alexa Conseguimos integrar ela com os equipamentos da casa e adicionar lembretes lista de compras e etc.,2021-07-31 00:00:00
positivo,Gostei do modelo reconhece bem a voz e o som bastante alto não tem chiado Achei um pouco difícil a configuração para a TV e poderia funcionar sem ficar o tempo todo na tomada,2022-02-22 00:00:00
negativo,Eu esperava que ela melhor direcionasse as pesquisas e que ela realmente fizesse sugestões de musicas conforme solicitado sem falar que o som embora seja nítido nao é tao alto,2021-12-22 00:00:00
positivo,usei pouco porque minha casa esta em reforma mas gostei do que vi ate agora,2021-01-08 00:00:00
positivo,Adquiri pela necessidade de um dispositivo de som em minha casa Atendeu perfeitamente a espectativa Ainda estou aprendendo a usar os comandos e aproveitar ao máximo minha echo,2021-07-03 00:00:00
positivo,Produto tem um som de qualidade o reconhecimento de voz é muito bom mesmo quando ela está reproduzindo uma musica Atende aos comandos de voz facilmente e é de fácil utilização,2021-04-03 00:00:00
positivo,Produto muito bom Superou minhas expectativas som nítido as vezes tem q chamar ela mais de uma vez para obedecer o comando Fora isso gostei muito e estou curtido bastante,2021-06-18 00:00:00
positivo,Muito legal gostei bastante da Caixa Alexia tem uma boa qualidade de som podemos levar pra qualquer lugar tem um ótimo reconhecimento de voz vale muito o preço muito justo,2021-02-07 00:00:00
negativo,A Alexa não entende nada do que você fala não toca as músicas que peço desde que comprei só fiz passar raiva Você tem de falar com ela gritando pra ela escutar Não faz nem 2 meses e já quero vender,2021-08-26 00:00:00
positivo,A Alexa além de essencial é muito divertida Ela faz tudo eu uso todo dia a toda hora o reconhecimento de voz é muito bom A qualidade surpreende E as Skills são sensacionais,2021-03-25 00:00:00
positivo,Eu tenha a de terceira geração e quis uma outra Echo Dot para a minha casa por isso da compra desta de 4a geração mas assim como a anterior ela é excelente,2022-03-14 00:00:00
negativo,Gostei da interatividade porém tem horas que Alexa parec e meio surda nem sempre atende aos comandos com precisão e o som da caixa não pode aumentar muito pois distorce,2021-07-09 00:00:00
positivo,Minha primeira Alexa e estou gostando muito ela reconhece muito bem o que eu falo tem um som muito bom e além disso não para de me surpreender com suas funcionalidades,2020-12-02 00:00:00
positivo,O reconhecimento de voz nem sempre é perfeito apesar de ser muito bom Achei a quantidade e a qualidade das skins um pouco decepcionante,2021-07-11 00:00:00
positivo,Gostei muito mas achei que ela conectava com os streaming porém não Ela só lida e desliga a tv Pensei que conectasse com YouTube Netflix prime vídeo,2021-07-16 00:00:00
positivo,Excelente produto atendeu todas as minhas expectativas Só não gostei da transportadora Loggy pois a caixa chegou toda amaçada e a entrega demorou mais que o normal,2021-07-18 00:00:00
positivo,Compramos uma para minha mãe e está sendo de grande utilidade devido facilidade e praticidade do uso Recomendo,2022-03-07 00:00:00
positivo,A mídia não pôde ser carregada Excelente produto cada dia ela fica mais sensível ao que eu falo Fazendo com que ela erre menos nos comandos lançado a ela,2020-12-08 00:00:00
positivo,O produto é show de vez em quando somos surpreendidos com uma interação nova ainda não testei 50 dos recursos mas já estou muito satisfeito,2021-07-15 00:00:00
positivo,A princípio tem as mesmas funcionalidades que o echo dot 3 Senti uma melhora suave no som apenas,2021-01-14 00:00:00
positivo,Não sei se é uma questão de reverberação pois dependendo do local e do volume do som do echo dot vc precisa falar mais alto e algumas vezes a Alexa executa comando errado,2021-01-28 00:00:00
positivo,Correspondeu todas minhas expectativas e um pouco mais por ser uma echo dot tem um volume alto de som mas deixando ela no volume alto da pra perceber um pouco de chiado no grave,2021-07-11 00:00:00
negativo,Achei muito difícil de programar e é pouco intuitivo até mesmo tutoriais na internet são pouco explicativos Ainda não consegui criar nenhum comando,2021-07-20 00:00:00
positivo,E muito top Alexa sensacional entrega super rápida,2021-07-01 00:00:00
positivo,Gostei do produto Mas é preciso ter mais aprimoramento na AI inteligência artificial do produto mais skills e mecanismo de busca e pesquisa ampliado com o Google e outros,2021-08-14 00:00:00
positivo,A qualidade do som é excelente o único defeito é que elas às vezes não escuta ou interpreta errado oque é falado mas nada que comprometa o uso após algumas repetições de comando,2021-05-05 00:00:00
positivo,Muito interessante o comando de voz Permite intervenções a distância e em momentos em que não seria possível o uso de controle por exemplo no banho,2021-07-13 00:00:00
positivo,Produto de excelência qualidade padrão Amazon tudo o que você pedir a Alexa faz e não tem nenhum delay como muitos falaram nos comentários acima Gostei do Echo Dot e o Próximo vai ser o Echo Show 8,2021-05-24 00:00:00
positivo,Produto excelente o qual minhas filhas se divertem conversando com a Alexa Além de ser um produto que me auxilia bastante no dia como informações de noticias musicas entre outros,2021-07-30 00:00:00
positivo,Atualizações e interações ótimas fácil uso Muita praticidade e reconhecimento de voz excelente Não vivo sem,2021-08-25 00:00:00
