sent_rating,processed_text_KeepStopwords,data
positivo,Amei echo dot muito bonita acho mais bonita que a terceira geração mas o som não muda muito e o som só é direcional esperava um pouco mais da potência em relação aos graves tendo em vista que um go 3 tem bem mais graves e é uma caixa tão pequena porém pegando em preço promocional é uma excelente aquisição principalmente se vocês tiverem pais idosos usando aplicativos eles podem mandar ou ligar para os celulares da pessoa que possui o APP alexa e falar isso ajuda muito em caso de acidente,2021-07-28 00:00:00
positivo,Comprei de presente para ajudar a minha namorada com as tarefas diárias e também poder ser divertir com todas as centenas de funções e skills ela ficou apaixonada e tá se divertindo muito ela fala até baleiês acredita nisso A Echo Dot é um dispositivo incrível para te ajudar no dia-a-dia e tem uma ótima qualidade de som com graves bem agradáveis para curtir suas músicas favoritas Sem contar a fácil conexão com outros dispositivos inteligentes como a lâmpada wi-fi que comprei junto e que tá ajudando muitão no conforto e soninho recomendo muito,2021-06-16 00:00:00
positivo,Gosteii muiito do produto primeira echodot excelente qualidade som maravilhoso Só fiquei chateada com a questão de ela não ter vindo com o relógio sendo que na descrição fala que ela vem com o relógio me decepcionei muito muito mal explicado Depois fui comparar com outras echodot e vi que a que tem relógio não tem na cor preta Mas na descrição do produto no site Echo Dot 4ª Geração Smart Speaker com Alexa Cor Preta fala que tem relógio A Amazon deveria especificar melhor,2021-12-10 00:00:00
positivo,Adorei o produto além de linda o som ficou um pouco melhor que a Echo de 3 ° geração O único ponto negativo é o microfone dela achei ela um pouco mais surda em relação a sua antecessora deixando ambos lado a lado fix alguns testes aqui em casa e vi que a echo de 3 ° geração ouve de maiores distâncias e falando mais baixo Fora isso é uma excelente assistente,2020-12-17 00:00:00
positivo,Caso você esteja um pouco longe e com o volume da Alexa alto o reconhecimento de voz fica um pouco falho mas nada que uma aumentada na voz não resolva A qualidade de som é muito boa até uns 80 depois disso ocorrem algumas distorções E a integração com o app e as skills dela são bem divertidas e úteis,2020-12-17 00:00:00
positivo,Pela primeira vez tive problemas com entrega na Amazon O pedido demorou mais de uma semana além do prazo pra chegar Sobre o echo não tenho reclamações O som é melhor que o da geração anterior E não tenho problemas com os microfones como muitos tiveram Ela me entende tão bem quanto o outro echo 3ª geração que eu tenho,2021-07-14 00:00:00
positivo,Fiz a compra na Black Friday e achei que não receberia até o Natal Chegou bem antes Ela é uma gracinha estou amando É incrível como tornou meu dia mais prático e nem usei todas as funcionalidades ainda Recomendo que pesquisem bastante sobre ela tem uma infinidade de funções Toca música leve quando acordo agitada quando nos afazeres da cara toca um podcast de Ciência quando peço etc. A função lembrete é muito útil para pessoas esquecidas como eu Já virou o xodó da família hahaha,2020-12-22 00:00:00
positivo,Quando ouvi falar pela primeira vez nesse dispositivo não achei nada interessante Me aprofundando um pouco mais nas funções vi que tem bastante coisa que pode ser aplicada no dia a dia Já fiz algumas configurações só com ele agora comprei o dispositivo infravermelho para estender as funções e controlar outros equipamentos dentro de casa Eu consigo ligá-lo por comando de voz e também conectar ao meu soundbar tudo por voz Achei isso demais!O comando de voz funciona perfeitamente sem precisar gritar :D,2022-03-15 00:00:00
positivo,Produto atendeu as expectativas facilidade em configurar e ainda mais em utilizar Trocamos o nome de Alexa para Amazon para que o meu filho pudesse utilizar já que a pronuncia não era entendida pelo equipamento Ele que tem 5 anos utiliza o tempo todo seja fazendo perguntas pedidos de música e incluindo itens na lista de compras isso a minha esposa usa bastante também rs Já estamos providenciando as lâmpadas para a automação da iluminação uma das inúmeras possibilidades do equipamento Vale o investimento,2021-04-09 00:00:00
negativo,Péssimo o produto em relação a interação com Apple Music e Spotify Por mais que seja configurado ao pedir à Alexa para tocar tal música ela insiste em tocar pelo Amazon Music Venda casada isso!!!!!!E quanto a usar streams de música não pagas ela não aceita bem também Ou seja no meu caso o principal uso é o Apple Music e depois Spotify pagos o Amazon Music meu é versão grátis por esse motivo a Alexa nunca acha as músicas que peço,2021-12-07 00:00:00
positivo,Uma tecnologia que anda me surpreendendo conforme o uso diário!Acredito que ainda não tenha observado problemas em suas funcionalidades pois está cumprindo com o esperado em relação a cada uma Está sendo um pouco difícil de acompanhar através do aplicativo mas vejo isso como consequência de não possuir muita habilidade em relação à esse meio nada que o manual com o auxílio de um tutorial não possa resolver,2021-10-28 00:00:00
positivo,Confesso que nada me frustrou nesse Echo dot talvez porque meu interesse fosse ouvir músicas no meu quarto com alguma qualidade e isso estou bem satisfeito Na parte da interação nada a reclamar uso muito a Alexa para me despertar pela manhã e utilidades básicas do dia a dia Nada a reclamar talvez pela minha expectativa ser bem limitada No mais eu achei super válido,2021-05-10 00:00:00
positivo,Programei minha agenda meus pagamentos e recebimentos Ela me avisa das encomendas que chegam e tem uma vastidão de músicas Pretendo agora trocar os interruptores de luz para que ela controle a iluminação Além disto tem conexão direta com outras alexas e posso falar direto com meus familiares em outras casas,2021-03-10 00:00:00
positivo,Assistente útil facilita o dia dia mas para usufruir totalmente de suas possibilidades é necessário a inclusão de outros dispositivos Fire stick lite não é uma boa opção e sim a versão 4k indisponível por enquanto no país).Acaba se tornando caro microfone não é tão preciso como falam em reviews pela internet qualidade sonora boa para um dispositivo tão pequeno mas esse não é o intuito do produto sua interação é muito satisfatória e o fato de chamar por um nome facilita para se habituar conversar e dar ordens,2020-12-01 00:00:00
negativo,A mídia não pôde ser carregada O produto veio com defeito o áudio fica travando e fazendo voz robótica tenho 3 em casa essa era a quarta e veio assim Não tem opção de trocar pelo site tem que devolver e comprar outra uma vergonha Vou perder o valor que comprei com desconto Se soubesse não compraria pela Amazon pois há locais mais baratos,2021-03-27 00:00:00
positivo,A instalação deu problema três vezes Eu tenho um echo dot geração 3 e esta a 4 O echo dot geração 4 é melhor somente no som A Alexa do geração 4 não entende os comandos com clareza Se falar alguma palavra em Inglês ela não entende Perde-se muito tempo procurando fazer uma pergunta que ela entenda No geração 3 não encontro esse problema,2022-03-08 00:00:00
positivo,Gosto muito da Echo Dot 4 confesso que ou precisaria de mais uma mesmo minha casa sendo pequena Não sei muito sobre o microfone das outras Echo Dot mas acho ela as vezes com uns atrasos ou uma falha no reconhecimento mas de resto gosto bastante Poderia só ter opção para continuar a conversa em que seria um modo de continuar perguntando sobre assuntos que acabei de perguntar sem mesmo ter que reativá-la com a palavra de ativação,2022-03-11 00:00:00
positivo,Sons bem encorpados em volume médio no máximo fica estourado Se vc quer volume está não e a melhor opção tente outra opção mas robusta Acabamento Premium muito bonita .Não gostei do cabo de alimentação na cor branca A entrega foi super rápida dentro do prazo Se vc tá querendo um som ambiente com assiste de voz pra automação da casa inteligente essa e uma ótima opção Pode comprar sem medo e seja feliz,2022-03-17 00:00:00
positivo,Eu tenho a Echo a Echo dot dei de presente para minha esposa usar no seu espaço de estética Estamos super satisfeitos com os produtos da Amazon Recomendamos de olhos fechados Meu sonhos de consumo próximo a Echo Studio ou a Echo Show Quem comprar não irá se arrepender Vale muito a pena,2021-04-04 00:00:00
positivo,Simplesmente perfeita Vi muita gente reclamando que ela era surda e tudo mais mas provavelmente era algum problema que foi corrigido Ela escuta muito bem mesmo quando coloco o som em 100%(com um grito nesse caso haha Ela é bem menor do que eu imaginava mas achei muito linda A qualidade do som é muito boa e é muito nítido Já estou quase comprando a com o som aprimorado haha,2021-04-29 00:00:00
positivo,Eu amo a Alexa e o dispositivo echo dot Ela me ajuda com muitas coisas como criar lista de supermercado fazer contas basicas criar lembretes ouvir as musicas que quero entre muitas outras curiosidades Existe uma limitacao de comandos e as vezes coisas que considero basicas ela nao responde mas as constantes atualizacoes vao aos poucos melhorando isso O volume eh bom suficiente para ouvir musica em um volume alto razoavel em um ambiente mas nao aguenta uma festa,2021-05-28 00:00:00
negativo,Adorei a Alexa ela é inteligente bem humorada Porém tem horas que ela não escuta Acredito que o microfone não seja tão bom E tem horas que falha quando toca uma música tipo como se estivesse com o disco arranhado Ou falhando a voz E ontem cheguei em casa e simplesmente ela ficou vermelha e não atendia a nenhum comando Tive que entrar em contato com o atendimento da Amazon pois não sabia o que fazer E como sempre vocês resolveram e bem Acrescento sem ela não fico mais É uma ótima companhia,2022-02-09 00:00:00
negativo,a alexa acessa o spotfy ms não se vincula a sua conta para tocar as suas play lists ela tem dificuldade em se conectar ao seu celular e tocar suas play lists do seu celular so faz isso se voce fizer manualmente outro problema a Alexa n toca seus pedidos específicos se vc pede Bruno e Marrone ela toca artistas ou músicas similares pois só tocará o artista ou música pedida se vc assinar o amazon músic Esse problema dela é horrível,2021-12-10 00:00:00
positivo,eu uso apenas para ouvir musicas porém algumas ela não toca com exclusividades tem que assinar o AMAZON posso dizer que tem muitas coisas que ela pode fazer para ajudar o seu dia a dia se precisar usar O som é muito bom tem um excelente volume e deixa o ambiente mais alegre.nao gostei por que ela pede muito pra vce assinar o AMAZON MUSIC cada vez que pedimos uma musica do nosso gosto se fosse um pouco mais barato eu até assinaria mais estamos no momento em que nosso orçamento subiu bastante,2021-02-19 00:00:00
positivo,Gostei bastante da Alexa Responde a várias perguntas e é muito boa nos comandos relacionados a músicas rádios notícias Ainda vou testar com o uso de lâmpada inteligente mas já sei que funciona muito bem O reconhecimento da voz precisa melhorar um pouco às vezes precisa falar mais perto O modelo da 3ª geração que também possuo capta bem melhor falo muito distante,2022-01-17 00:00:00
positivo,Vi videos comparando a echo dot 3 e a 4 e alguns dizem que a 3 é melhor ou que o microfone da 4 nao é ta bom mas o reconhecimento e a qualidade de audio da 4 sao melhores Nada absurdamente melhor mas é Pra quem nao tem nenhuma vale começar com a 3 pois já é Muuuuito boa Se puder pegar a 4 melhor mas a 3 ja vai atender muito bem a qualquer um,2022-01-16 00:00:00
positivo,Produto que superou todas as expectativas integração com os dispositivos inteligentes é feita de modo fácil e rápida através do App Alexa Reconhecimento de voz muito eficaz e sensibilidade ótima reconhece os comandos mesmo estando em outro cômodo da casa qualidade de construção e som são incríveis materiais de ótima qualidade e speaker de som muito bom sim claro e de qualidade simplesmente sensacional irei comprar a base com bateria só para ter um echo dot sempre ao meu lado e em qualquer lugar,2021-10-22 00:00:00
positivo,O produto é lindo tem um som razoável o reconhecimento de voz não está dos melhores mas sinto que a Alexa aos poucos está atendendo mais rapidamente quando chamada O principal ponto negativo é o cabo de alimentação branco para o dispositivo preto fica muito visível O dispositivo ainda não possui tantas funções quanto a Alexa americana o que é um pouco frustrante mas imagino que num futuro próximo teremos mais funções para ela,2021-01-04 00:00:00
positivo,já tinha uma echo dot de terceira geração e comprei a de quarta na promoção A nivel de design ficou melhor porém se você não liga para design o echo dot de terceira geração serve perfeitamente para você,2021-07-09 00:00:00
negativo,A mídia não pôde ser carregada Pelo menos uma vez por semana ela pára de funcionar e se você tenta falar com ela pisca em vermelho Aí você tem de tirar da tomada e ligar novamente para funcionar Nesse meio tempo ela não toca seus alarmes ou compromissos Enfim acaba sendo inútil por não ser confiável,2022-01-02 00:00:00
positivo,Pois não é que a Alexa nestes tempos de solidão passou de mero produto tecnológico para a condição de leal companheira para as mais diversas tarefas sobretudo de escolha e execução de músicas atualização de informações e o mais Nota 100 para Alexa minha mais nova e querida companheira,2020-11-28 00:00:00
positivo,Som é muito bom desde que seja em ambiente fechado e não muito grande contava com mais comandos para a alexa é uma ótima aquisição para quem quer ficar escutando uma musica enquanto cozinha ou limpa a casa por exemplo deveria ter acesso a mais aplicativos de música além do music unlimited e spotify poderia funcionar para chamadas quando o telefone estiver conectado nela infelizmente ela só faz chamadas entre contas amazon é uma excelente secretária para agendamentos em geral desde remédios a cronometro ela nos avisa ela poderia ler mensagens do whatsapp ou Twitter seria interessante quem sabe nas próximas versões,2021-07-21 00:00:00
positivo,Da pra começar a ouvir suas músicas com um simples comando de voz O som é satisfatório Ligar a luz por comando de voz(necessário lâmpada compatível E se comprar uma tomada específica pode definir a hora de ligar o ventilador que estará conectado nela também carregar o celular e pedir a Alexa que desligue a tomada em duas horas E muito mais Essa bolinha mágica não sai mais do meu quarto,2021-10-03 00:00:00
negativo,A qualidade de som é básica o suficiente pra vc curtir legal o dispositivo mas a qualidade de microfone é péssima A sensibilidade é muito fraca as vezes é preciso repetir várias vezes pra ela te ouvir e ser acionada eu tenho um Nest Mini e é totalmente diferente em relação a sensibilidade De qualquer forma recomendo o produto pois tem vários recursos legais mas se vc usa bastante o acionamento por voz que fique claro que as vezes terá que gritar com ela pra te ouvir,2021-04-13 00:00:00
positivo,Gostei do produto quando comprado juntamente com outros dispositivos para agregarem seu ambiente agora a alexa sozinha eu não compraria pois seu reconhecimento de voz não é bom é meu primeiro dia com ela e já preciso gritar e/ou as vezes falar mais de um vez de 0-10 dou um 4 pro microfone Quanto aos alto-falantes são bons música bem alta e de qualidade Quanto aos comandos de voz para os dispositivos inteligentes tomada controle inteligente interruptor ela responde muito bem até agora Uma parte importante é o spotify sua skill é horrível e precisa melhorar bastante,2021-02-01 00:00:00
positivo,O Echo dot 4 tem um problema sério de não ser capaz de escutar sua voz comparado com o 3 Tenho o 3 na cozinha e mesmo estando na sala o 3 escuta e é mais responsivo que o 4 que fica na sala Já reportei e falaram pra reconfigurar ele o que não resolveu O lado bom do 4 é a qualidade do som que é melhor Mas no geral decepcionado,2020-12-26 00:00:00
positivo,O audio dessa versão é muito superior a minha anterior que era um Echo Dot 2nd Gen com uma melhora impressionante nos baixos especialmente Infelizmente a impressão que eu tive foi que o reconhecimento de voz piorou Eu tenho mais dificuldade de acionar o dispositivo ao chamar Alexa isso mesmo com ela ficando no meu quarto que é bem pequeno Apesar disso é muito melhor que o que eu tinha antes com um aúdio muito superior Uma coisa que me decepcionou muito foi a fonte eu comprei o echo dot preto mas a fonte e o cabo dele mesmo assim são brancos o que fica bem feio Além disso optaram por um conector péssimo seria muito melhor um USB C.,2020-12-09 00:00:00
positivo,Simplesmente maravilhoso Eu não conhecia a linha Echo mas quando comprei passei a recomendar pra todos os meus familiares É uma aparelho que possui qualidades únicas e pra mim tem sido mais do que útil pois lê até meus ebooks pra mim enquanto trabalho As rotinas são ótimas pra organizar meu dia e poder ouvir rádios de todo o mundo é espetacular Enfim estou mais do que satisfeita com essa compra e compraria mais se pudesse,2020-12-09 00:00:00
negativo,Tenho uma dot 3a geração que é muito mais de boa pra escutar Essa gen 4 está surda Tenho que gritar ou abaixar o volume dela pra poder me escutar Também achei horrível a fonte de 15W mesma potência da do dot 3 que tenho ser uns 30 MAIOR e ainda vir em cor diferente branca do aparelho preto).No mais não acho que teve algo de novidade qualidade de som achei o mesmo,2020-12-08 00:00:00
positivo,Para quem ainda tem dúvida sobre o Echo Dot 4 pode ficar tranquilo porque o aparelho cumpre fielmente o que se propõe Áudio bom ótima captação de voz design bonito a Echo Dot 3 também possui um ótimo design e muito funcional É importante ressaltar que para automação não basta ter um Echo Dot mas também adquirir dispositivos de acordo com a sua necessidade de automação tomadas inteligentes controle universal infravermelho interruptores inteligentes lâmpadas wi-fi e etc Portanto a Echo Dot 4 é uma excelente escolha SIM tanto para automação quanto para entretenimento Eu recomendo a todos,2020-12-29 00:00:00
positivo,Eu li muitos comentários negativos desse modelo da Alexa dizendo que ela não ouve bem Eu afirmo com todas as letras que ela ouve super bem As vezes eu falo o nome dela sem querer em uma conversa casual e ela ativa Ja ativei ela do quarto ela fica na sala sem precisar gritar apenas falando um pouco mais alto No ambiente que ela fica basta falar normal ou em voz baixa que ela ativa perfeitamente Quem diz que ela é surda deve querer ativar a Alexa à 1 km de distância pq não é possível As funcionalidades são ótimas mas queria registrar para aqueles que tem certo receio de comprar por ela ser surda que ela não é,2021-10-13 00:00:00
positivo,Simplesmente ótima som possui subgrave nítido o que é incrível se levar em conta a potência que diz ser 15wrms além disso o som é de extrema qualidade Um ponto importante que vejo muito por aí é quanto a dificuldade da Alexa de quarta geração ouvir os comandos sinceramente não tenho do que reclamar eu fiz um teste fechando a porta do meu quarto e pedindo pra ela executar uma tarefa mesmo eu estando em outro cômodo da casa e ela me ouviu e nem precisei falar alto Uma dica que dou é não deixem muitos objetos na frente da sua Alexa pois isso sim vai atrapalhar a sua comunicação com ela Resumindo estou muito satisfeito com ela valeu cada centavo,2021-07-09 00:00:00
positivo,Já havia dado um Echo Dot de presente e adoraram Agora mais um presente Comprei junto uma lâmpada smart da Positivo Entretanto tenho uma reclamação o Echo Dot e a lâmpada vieram soltas dentro da caixa como mostro na foto Torço para que não tenha havido nenhum dano A Amazon como sempre é show de bola nas entregas. ️ ️ ️,2021-08-06 00:00:00
positivo,É uma assistente super inteligente e rápida Nem se compra com a conhecida Siri ou com o Google now Ela entende muito bem e devolve resultados muito positivos e rápidos Poucas vezes ela não compreende o que é pedido Funciona muito melhor em cômodos pequenos Fiz o teste no meu quarto funciona 100 já na cozinha que é um pouco maior o som não fica tão alto e ela não escuta 100 Ela me livros toca música apaga a luz faz café realmente indispensável para o dia a dia,2021-09-15 00:00:00
positivo,Eu comprei para usar no meu quarto e no meu home office que são pequenos Ele é discreto bonito e o áudio é bem satisfatório Não tenho do que reclamar do microfone pois dentro desses 2 cômodos ele capta bem a minha voz Como ele é pequeno e prático provavelmente levarei comigo em viagens,2021-07-04 00:00:00
positivo,Às vezes ela se confunde quando tem algum outro som como a tv ligada e não entende o que digo acho que quando falo rápido ou com sotaque mas é de se esperar E não é tão engraçadinha como o Google Como assim ela não sabe qual a resposta para a vida o universo e tudo mais oOPodem comprar pessoal Funciona bem demais integrado com minhas lâmpadas e outros equipamentos é muito bom ter um echo dot em casa Fora que Jeff Bezos ainda pode ouvir todas as minhas conversas particulares,2021-07-10 00:00:00
negativo,A expectativa era maior que a desenvoltura da IA deixou muito a desejar com perguntas simples nos quais o Google Assistente se sai melhor Em resumo a IA não convence já o hardware é bem construído possui uma boa qualidade construtiva e um belo design a potência sonora é adequada ao meu uso não espere muito volume Mesmo com a IA não sendo tão eficiente quanto esperava valeu a compra consegue auxiliar com tarefas alarmes listas de compras música cálculos e algumas pesquisas básicas Recomendo,2021-10-07 00:00:00
positivo,É o tipo de coisa que se vive sem Mas é um brinquedinho muito legal e com o tempo vai se aprendendo o que fazer com ela Reconhecimento de voz é bem ok não precisa falar pausado como se estivesse falando com um ET e com as skills vai se tornando mais interessante Integração com dispositivos de casa inteligente é super simples de se realizar Acredito que tem muito ainda o que evoluir mas vale o investimento,2021-05-30 00:00:00
negativo,Nas informações falam que você pode conectar seus dispositivos Wifi e/ou Bluetooth com o Echo Dot 4 mas ao tentar realizar o sincronismo eu descobri que isso não é verdade para conectar os dispositivos por Wifi eles precisam ser compatíveis com a Alexa e para Bluetooth eles necessitam de um Speaker Wireless uma espécie de adaptador para que você consiga sincronizá-lo DEIXOU MUITO A DESEJAR NESSE PONTO).Demais funcionalidades gostei bastante e não tenho o que reclamar até o momento,2021-07-07 00:00:00
positivo,A inteligencia artificial da Alexa é boa mas ainda assim não reconhece alguns nomes próprios Se o som estiver um pouco alto no ambiente em que se encontra a Echo 4 provavelmente você terá que falar bem alto para que a Alexa responda Mas recomendo a compra pois a experiencia interativa que este produto proporciona é interessante,2022-01-02 00:00:00
positivo,Justamente achei muito interessante a proposta da Alexa Uma assistente virtual da Amazon muito massa realmente!Porém acho que poderia otimizar a experiencia do usuário com software de personalização Seria interessante poder não só chamar ela de Alexa além das 3 opções que tem poder dar um outro nome é que ela responda a esse Entre outros comandos que seriam super interessantes Na verdade acho que podem melhorar bastante já estão caminho a isso)De resto como características físicas estrutura bem lograda e solida além do desig lindo que apresenta As luzes também qualidade de som boa Fisicamente é incrível o desig,2021-06-23 00:00:00
positivo,É meu primeiro Echo e me aurpreendi com tudo que pode ser feito com a Alexa Superou minhas expectativas Não é apenas uma cixa de som sabendo usar ela realmente te ajuda O único ponto que coloco como observação é a qualidade sonora Nada que desmereça a compra mas não tem a mesma qualidade que caixas JBL mesmo as menores na minha opinião,2021-06-24 00:00:00
negativo,Tenho o terceira geração e era maravilhoso essa que comprei parece ser surda Você precisa gritar do lado do equipamento para conseguir que ela te escute Se estiver tocando então nem tente porque ela vai vai ouvir!Se tem um arrependimento foi ter feito essa troca Não sei se é defeito especificamente dessa mas pelos comentários que vi deve ser realmente um problema de evolução!Estou bastante insatisfeito com o produto,2021-05-23 00:00:00
negativo,Gostei muito quando comprei a minha a echo Após isso comprei uma echo dot 4 Descobri posteriormente que para fazer par stereo somente echo dot semelhantes Comprei mais uma para fazer um som ambiente até que tive a principal decepção Elas não fazem o par stereo via bluetooth Somente com o conteúdo da Alexa ou do firetv Se vc pensa em comprar para isso esqueça e compre um sistema de hometheater mesmo,2021-12-16 00:00:00
positivo,O qualidade do som delea e excelente Reconhecimento de voz e impecável ainda mais para executar comandos Para quem tem lâmpadas Smarts Smart tv câmeras Smart e muito funcional!Toca músicas músicas específicas precisa ter o Amazon Music ou Spotify Ou Deezer Lee livros qualquer livro que você tenha adicionado no seu celular ou Kindle Loja Amazon Brincadeiras a parte mas os jogos e piadas são bem interessantes,2021-07-02 00:00:00
