sent_rating,processed_text_KeepStopwords,data
positivo,Eu estava procurando uma caixinha de som bluetooth e pelo preço e funcionalidades optei pelo encho dote e não me arrependi A qualidade do som é excelente para um cômodo Reconhece minha voz a distância Acho que o único ponto negativo seria ficar ligado direto na tomada mas isso não me incomoda,2021-07-30 00:00:00
negativo,Comprei minha Alexa em maio e pra minha surpresa a mesma começou a apresentar alguns defeitos no final de agosto A mesma ativa sozinha os diferentes itens da casa inteligente mesmo sem receber comando e se mantém acessa embaixo ainda que não tenha mensagem recebida a ser informada,2021-09-05 00:00:00
positivo,Vale a pena eu adoro é útil e funcional Todas as qualidades da Alexa que são muuuitaas No entanto se eu fosse você compraria a echo dot 3ª geração pois vc só pagará mais caro pela qualidade do som que sinceramente não muda muito da 3ª para a 4º eu tenho ambas e já comparei,2020-12-15 00:00:00
positivo,Já tinha um echo dot 3 pra ser sincero não tem nenhuma diferença pelo contrário essa echo dot 4 parece ser surda inúmeras vezes ela não te ouve enquanto a 3 funciona perfeitamente Tirando isso tudo de bom,2021-03-26 00:00:00
positivo,A mídia não pôde ser carregada Amei o Echo Dot Apesar de ter um uso limitado em minha residência ele é perfeito para ouvir músicas notícias e leituras de skill compatíveis A voz é suave e agradável Fácil de usar Agora falta agregar acessórios para aumentar sua funcionabilidade,2021-04-14 00:00:00
positivo,O som da alexa sem dúvidas é muito bom Porém quando uso ela a partir do volume 8 o som simplesmente estoura a voz dela fica tipo com chiado mas só quando a utilizo nos volumes altos não atrapalha nem nada mas eu me incomodei com isso espero que nas próximas gerações isso seja resolvido,2021-08-02 00:00:00
positivo,Posso dizer que está sendo uma experiência fantástica O reconhecimento de voz são totalmente intuitivos Sua configuração rápida e fácil Qualidade do som espetacular limpo e nítido Torço pra esta tecnologia avançar ainda mais O formato redondo super lindo Estou encantada!!É a segunda Alexa que compro Desta vez foi para presente,2021-01-31 00:00:00
positivo,A mídia não pôde ser carregada Bom Eu comprei a Echo dot 3 em outra distribuidora porém quando vi está e estudei ela e vi a pouca diferença de preço logo cancelei a compra da anterior e peguei está o design e tudo mais espero não ter problemas de defeito ou algo mais fora isso ela é surpreendente COMPREM Vale cada centavo,2021-03-30 00:00:00
positivo,Gostei do produto as automações que fiz funcionam bem Spotify a TV e o PC tudo controlado via Alexa Mas mas o som poderia ser mais agudo tem caixas de som mais baratas que tem um som bem mais limpo Não pode ouvir música muito alto senão distorce Mas no geral estou be satisfeito,2021-06-17 00:00:00
positivo,Produto muito bom Acho que todos deveriam ter uma Alexa em casa Vc não precisa ter uma casa inteligente para ter uma Ela é essencial em tudo Despertador alarme para lembretes lembrar tempo de afazeres na cozinha tocar aquele sertanejo de manhã etc. Ela faz muita coisa Recomendo sem dúvida,2022-03-18 00:00:00
positivo,Produto como o esperado boa aparência e varias utilidades Porém depois de alguns dias caso você não tenha outros equipamentos como lâmpadas ou algo do tipo ele fica um pouco esquecido Recomendo compra-lo apenas quando tiver condições de comprar tomadas e lâmpadas inteligentes,2021-01-24 00:00:00
negativo,Não funcionaMeu echo não funciona ja reclamei disseram que apos um mes não poderiam trocar pois pssou a garantia Ja fiquei mais de 3 horas juntando todas as chamadas ao telefone fazendo teste s com operadors e nada de resolverem ou trocarem meu aparelho Muito insatisfeita,2021-08-20 00:00:00
positivo,Ela é excelente Difícil fazer minha filha estudar tabuada depois que Alexa chegou Ela faz parte da família Acho que o som poderia melhorar um pouco ter mais qualidade e potencia Não dá fazer festa mas é ótimo,2021-11-09 00:00:00
positivo,O produto não é tão fantástico quanto eles dizem ser a Alexa tem dificuldade em entender mesmo a melhor pronuncia em outros idiomas além de quem insiste em reproduzir músicas pelo prime music o que é muito chato já que eu nem uso esse serviço No geral é uma caixinha de som cara,2021-07-25 00:00:00
positivo,Ela ouve bem Não precisa ficar gritando Como caixa de só é ótima pois apesar do pequeno tamanho tem um volume bom Não da pra dar uma festa mas para o dia a dia está ótima Fácil configuração fácil utilização,2021-07-09 00:00:00
positivo,Eu já tinha outra Alexa agora comprei essa Li muita coisa que ela era surda Nada a ver Funciona perfeitamente Som muito bom Só não gostei de duas coisas A 1a onde se insere o fio O lado oposto seria muito melhor A 2a o fio deveria acompanhar a cor do produto Contudo nada disso seria motivo para eu deixar de comprar Aprovadíssima,2020-12-04 00:00:00
negativo,A mídia não pôde ser carregada Veio com o som falhando A 3a geração tá perfeita e essa sempre fica assim dando problema no áudio De fato a 4a geração o som é um pouco melhor mas por conta desses problemas eu não indico,2020-12-12 00:00:00
positivo,Achei muito boa a integração com outros produtos como spotfy e aplicações de casa inteligente A potência do som poderia ser maior Seria mais elegante funciona se tivesse bateria para não precisar ficar sempre na tomada O fio ligado no encho dor é muito feio,2020-12-20 00:00:00
positivo,Sem dúvida cumpre com tudo que é descrito É uma ótima assistente e pode facilitar no dia a dia ao fazer tarefas ao trabalhar ou então no entretenimento Caixa de som integrada de excelente qualidade e as skills que você pode colocar são muitas tornando a Alexa ou Echo dot ainda mais útil,2021-02-09 00:00:00
positivo,Tenho 3 dessas em casa Particularmente acho a Alexa meio burrinha e limitada como assistente de inteligência artificial mas eu tenho as Echos mais para ouvir música mesmo,2022-01-05 00:00:00
positivo,Realmente o Echo + Alexa é uma dupla imbatível e necessária Depois que adquiri e comecei a usar vi que realmente não é apenas divertida mas também muito útil Necessário claro aliar com assinatura de alguns serviços para poder explorar todo o potencial mas vale muito a pena Recomendo Amazon de parabéns,2021-04-09 00:00:00
positivo,Recomendo o produto apenas pra quem está disposto a investis nos outros periféricos que auxiliam na automação dos eletrônicos de casa Como eu já possuía no quarto uma lâmpada de cabeceira com conexão via wi-fi da smart life precisei apenas de um dispositivo de infravermellho para que automatizasse também a Tv e o Ar,2021-02-06 00:00:00
positivo,Como nunca tive uma Alexa estou achando muito boa a experiência O som é muito bom mesmo sendo a versão menor e está me atendendo em tudo que se propõe,2021-06-30 00:00:00
positivo,Bom produto mas infelizmente responde a todas as vozes não há um controle de voz adicionadas ao aplicativo quem vem quiser se comunica com ela Muito complicado para vincular aparelhos nela o que torna a experiência negativa Para pessoas idosas como minha vó é complicado a manipulação,2021-08-11 00:00:00
positivo,Simples instalação e com alguns recursos que o Google mini não possui como detecção de ronco e tosse Achei as respostas melhores que o Google nas perguntas x respostas Integacao similar com o diferencial que consegue ativar e desativar minha central de alarmes Coisa que o Google não consegue mesmo reconhecendo ela,2021-12-08 00:00:00
positivo,Achei muito legal Pra quem gosta de ouvir música já vale muito a pena A interação com a Alexa e sempre surgindo coisas novas é muito bom Acho que essa área tem muito a crescer e esse é o começo Uso muito pra música timer despertador Mas tem jogos frases etc. Bom pra quem tem criança vai interagir muito,2021-02-11 00:00:00
positivo,A mídia não pôde ser carregada Mto bacana sempre achei super interessante porém nessa promoção do prime day não tinha como perder a oportunidade Super satisfeito com a qualidade de som e os recursos que ela oferece 10/10 Fora que é mto mais bonita pessoalmente Nem da pra acreditar no som ela sendo tão pequena,2021-06-23 00:00:00
positivo,Se eu pudesse dava mil estrelas Estou completamente apaixonada Além de linda é super prática O som é ótimo para encontros em família estou amando demais E nem vou falar da entrega que foi MEGA rápida Amazon como sempre me surpreendendo amei tudo Estou super feliz e satisfeita com minha compra,2020-12-03 00:00:00
negativo,Aparelho com 3 meses já apresentou defeito no Wi-Fi e sem retorno do Amazon para garantia descaso total e pós venda péssimo,2021-04-12 00:00:00
positivo,Produto bom e funcional Consegui integrar todos os equipamentos smart de casa Mas diferente de outros relatos não concordo que ela tenha boa captação dos comandos quando você está em outro ambiente O ideal é que tenha mais de uma espalhada pela casa se quiser ser ouvido perfeitamente,2021-07-08 00:00:00
positivo,Minha menininha me surpreendeu positivamente Reconhece minha voz de longe tem um som ótimo me auxilia nos meus compromissos e nos horários de tomar remédios As vezes ela não conecta na playlist que peço é que tenho salva no Spotify mas nem vejo isso um grande problema Nota 10 Deveria ter comprado antes,2022-01-28 00:00:00
positivo,Eu comprei pra deixar no meu quarto o reconhecimento de voz é ótimo só tenho que repetir quando eu posiciono ela atrás do meu monitor do computador mas aí a culpa é minha haha ou então poucas vezes durante alguma música A qualidade do som é INCRÍVEL sem mais Áudio maravilhoso Recomendo de olhos fechados,2021-02-18 00:00:00
positivo,Produto excelente pena que no Brasil ainda não tenham muitas opções de serviços Tem a Jovem Pan com as notícias defasadas e Uol e G1 também não produzem muito Parecem que fazem obrigados Lamentável a descrença do mercado brasileiro num produto desta qualidade,2021-06-27 00:00:00
negativo,Tenho uma outra echo Dot de terceira geração com relógio há pouco mais de um ano A quarta geração eu achei que seria melhor Até o momento achei que o som dela não é tão bom quanto a anterior e ela tem mais dificuldades de ouvir aos comandos de voz Achei que seria melhor,2021-07-09 00:00:00
positivo,Excelente produto e com muita praticidade além de entender bem as chamadas da Alexa Utilizo o Google Home e a Alexa é levemente melhor nos poucos testes que realizei,2021-05-20 00:00:00
negativo,A mídia não pôde ser carregada Tenho uma echo dot 3 também porém essa que é a echo dot 4 devia ser melhor Acredito que seja defeito Como descrito no vídeo o som mesmo em volumes baixos apresenta uma textura de estouro chiando muito Já solicitei o reembolso e queria opção de troca pra de alguma forma comprar de novo pois gosto muito do equipamento,2021-04-15 00:00:00
positivo,Comprei pra dar de presente pro meu marido e rapidamente virou o xodó da casa Realmente ajuda no dia a dia a qualidade do som não é ruim e é um bom centro de controle pra casa inteligente Satisfeita e com vontade de comprar outras echos pra espalhar pela casa,2021-07-28 00:00:00
positivo,Experiência única com o Echo dot simplesmente fantástico a interação da Alexa com plataformas como Apple Music e Amazon Music ainda não testei com o Spotify mas também funciona No entanto achei o volume da Alexa baixo comparado com o Homepod Mini,2021-11-29 00:00:00
positivo,Produto excelente fácil configuração e posterior instalação Não apresentou nenhum problema O reconhecimento de voz para mim está perfeito Mesmo falando um pouco mais baixo a Echo entende Por tanto nota 10 Viva a internet o/,2020-11-14 00:00:00
positivo,Eu gostei bastante do equipamento no ebtsvdi sinto que diversas vezes o reconhecimento de voz precisa ser aprimorado falo algumas coisa e ela entende algo bem mais aleatório Além disso tem diversos momentos que tenho que falar umas 4 vezes Alexa para ela me ouvir,2021-04-03 00:00:00
positivo,Reconhecimento de voz qualquer pessoa a visitar pode comanda a Alexa isso não gostei Queria restringir os comandos apenas para mim e minha esposa Modo sono não entendi bem como usar Qualidade do som as vezes o som aumenta sozinho ou fica muito baixo,2021-06-03 00:00:00
positivo,É um produto que pode mudar sua rotina e te ajudar bastante demora um pouco pra pegar o jeito e as coisas boas que ele pode fazer pra você mas depois que você pesquisa um pouco sobre ele vê que tem muita coisa boa pra usar nele show de bola,2021-04-30 00:00:00
positivo,A caixa é pequena mas tem um bom som animou meu natal Poucas vezes a Alexa não entende o que falamos Para ter uma variedade grande é importante ter um streaming de músicas A cada dia aprendo novas funcionalidades algumas não são tão avançadas mas com o tempo isso vai sendo solucionado,2021-01-04 00:00:00
positivo,Pra quem tem uma da 3ª geração é bom saber que a quarta é linda e o som um pouco melhor Não mudou muita coisa mas pra quem quer começar com certeza vale a pena pegar o modelo novo Gostei demais,2020-12-02 00:00:00
positivo,A integração com o Spotify é muito melhor que a integração com o Deezer Para o segundo não consegui reproduzir minhas playlists só o flow e músicas específicas ou álbuns).A qualidade de som é compatível com o tipo de aparelho não é ótima mas não deixa a desejar pela faixa de preço,2021-07-12 00:00:00
positivo,É o meu primeiro dispositivo Alexa Simplesmente sensacional Às vezes falha mas no geral reconhece bem a fala É pequena e pelo tamanho me surpreende a qualidade e altura do som É um excelente dispositivo para se manter no escritório e em casa mas não para festas por exemplo Excelente,2021-01-09 00:00:00
positivo,É mto boa me ajuda nos agendamentos perfeito pra ouvir músicas sem eu ter que ficar digitando no celular é só pedir e ela atende além de ser engraçado as respostas dela O som é bem alto Melhor do que eu imaginei Poderia haver um for com bateria pois esse só funciona ligado a um cabo,2021-02-05 00:00:00
positivo,A Alexa facilita muito o dia a dia todas as informações que preciso de forma muito mais fácil e interativa Ela me acorda toca minhas músicas conta piadas e histórias Minha mãe adora perguntar as coisas para a Alexa enquanto estou no trabalho já é da família Super recomendo,2021-06-06 00:00:00
positivo,Gostei do preço promocional do prime day para aquisição do echo achei excelente principalmente como dispositivo de entretenimento com possibilidade para iniciar algumas automações domésticas Pretendo adquirir mais dois se o preço baixar novamente em alguma promoção,2021-07-16 00:00:00
positivo,O pessoal aqui fica escrevendo que o som não é muito bom que o reconhecimento de voz não é muito bom Para mim o custo benefício é perfeito Não tenho dificuldade com o reconhecimento de voz É muito rápida Tem um som excelente para o tamanho do dot Recomendo 100,2020-12-21 00:00:00
positivo,Me divirto bastante com a Alexa suas funções me ajudam bastante alarme lembretes previsão do tempo notícias minhas músicas todas salvas em play list enfim top demais,2021-07-08 00:00:00
negativo,O sistema não permite espelhar o que esta ouvindo no seu celular você precisa baixar os Skills que são poucos Youtube Music por exemplo não tem).Outro ponto negativo que não tinha reparado na compra é que só funciona ligado na tomada o que trava um pouco a usabilidade,2021-06-30 00:00:00
positivo,Algumas pessoas reclamam dos microfones que não são tão sensíveis no meu caso funcionou bem até sussurrando A qualidade do som é ótima utilizo também como caixa de som bluetooth do computador Ela é bem personalizável nas respostas,2021-06-10 00:00:00
positivo,É maravilhosa Eu to apaixonada Chegou em 2 dias De fato ela tem um pouco de dificuldade pra me ouvir mas nada demais Por 249 ela cumpre o que promete,2020-12-09 00:00:00
negativo,Ótimo produto mas tem um pouco de surdez o Google nest com 3 microfones escuta melhor Em compensação em termos de gerenciamento de automação humilha o Google nest Adorei,2021-06-27 00:00:00
positivo,Gostei do aparelho tenho dois deste e já estou querendo comprar um Echo Show 8.Gosto de escutar musicas sem muito custo mas acho que a assinatura no Amazon Music é um pouco alto tenho pessoas na minha familia que paga um valor e quando vou ver para mim é outro valor poderia ser igual,2021-07-16 00:00:00
negativo,O aplicativo usado para instalação não apresenta de forma clara a opção de wifi Até hoje já revirei tudo e não consigo Não sou leiga no assunto e imagino quem tenha menos conhecimento que eu como conseguiu resolver esse problema,2021-12-16 00:00:00
positivo,A todos que estiverem em dúvida sobre essa geração ou a 3a eu digo que você não vai se arrepender nem um pouquinho de ter esses auto-falantes maiores a alexa por si só é excepcional e com esse som limpo e bom fica ainda melhor aproveitar todas as funções da alexa,2021-08-21 00:00:00
positivo,Show comanda tudo aqui em casa luzes ar Tv som portão porta não tem limites o que pode fazer com ela além de um ótimo som equipamento de alto nível se não usar na automação só vai ser uma caixa de som inteligente comprei a segunda facilita a vida chegou bem antes do prometido,2021-03-17 00:00:00
negativo,Sinceramente como a Amazon que se propõe a ser a empresa do futuro faz um equipamento que não tem bateria e só funciona no cabo de energia Isso por si só descredencia o mesmo não recomendo Por outro lado vincula o seu equipamento na maioria das suas funcionalidades ao aplicativo Alexa Muito complicado o sistema Não recomendo Só funciona no cabo de energia,2020-12-06 00:00:00
negativo,A ativação por voz é bem ruinzinha surda O Echo Show é muito melhor Além disso no modo tocar em todo lugar ela perde sincronia frequentemente,2021-03-06 00:00:00
negativo,Com 3 meses de uso ela estourou a caixa pera mas isso não é coisa do passado Além de ser surda mas muito surda que dá até desgosto de ter que conversar gritar literalmente com ela e talvez ela te escute Enfim a minha serve mas foi a pior compra que eu poderia ter feito nós últimos meses,2021-04-26 00:00:00
negativo,Tem que berrar pra ela acordar depois você pode falar normal A inteligência não é tão inteligente vive bugando e não reconhecendo comandos que acabou de reconhecer minutos atrás Desapontado Não vale o investimento Melhor usar no app pra celular sem os dots,2021-06-10 00:00:00
positivo,Houve uma melhora não só em design o que mais notei desta versão para a terceira é o microfone que houve muito bem e tem uma resposta mais rápida o áudio é levemente melhorado apenas produto lindo só é mais pequeno do que eu imaginava,2021-12-14 00:00:00
positivo,Gostei da praticidade na automação da casa na qualidade de som para ouvir musica os pontos negativos são as vezes Alexa parece não escutar surda algumas palavras ela não pronuncia direito não respeitando as pontuações algumas coisas ela não sabe responder,2021-04-12 00:00:00
positivo,uma caixa pequena com potencia extrema estava com medo de compra pelo tamanho mais me surpreendi recebi depois de 5 dias de comprada ja uso a 1 semana e acabei de compra a maior echo 04 pois o som deve ser muito superior a certas caixas que vendem por ai super recomendo,2021-08-09 00:00:00
positivo,A Alexa no Brasil é uma boa aquisição mas ainda precisa de muitos melhoramentos no reconhecimento de voz e adaptação dos comandos às necessidades Ao realizar uma rotina que toca música por exemplo o aplicativo não aceita colocar músicas em modo aleatório A conexão com o Spotify também é precária,2021-01-04 00:00:00
positivo,Perfeita Muito útil Estou tenho problemas pra ela reconhecer a minha voz De outros membros da família ela reconhece sempre a minha de vez em quando ela não responde quando a chamo,2020-11-08 00:00:00
positivo,Para seu tamanho o som possui excelente qualidade gosto de escutar nele pela facilidade de pedir musica associada ao amazon music e ao spotify muito legal mesmo Alexa é divertida e funciona bem com outros dispositivos como o fire stick ainda não integrei a casa toda mas pretendo fazer em breve,2021-01-09 00:00:00
positivo,Segundo tipo de produto Amazon que compro antes havia comprado FireTVStick agora Echo Dot 4a ger simplesmente muito bom qualidade em todos os produtos com certeza comprarei mais,2022-03-19 00:00:00
positivo,A mídia não pôde ser carregada Infelizmente o reconhecimento de voz é fraco Muitas vezes ela não me escuta comparado com outros modelos Porém é muito bonita e sofisticada as luzes inferiores a deixam muito inovadora A assistente virtual Alexa é igual em qualquer modelo portanto nesse não é diferente a sua qualidade,2021-04-05 00:00:00
positivo,Meu primeiro echo echo dot 4ª geração já quero a studio é mto topp a experiência recomendo de mais mas o ideal é ter pelo menos o controle infravermelho pra automatizar os aparelhos que usam controle remoto Agora ar condicionado e TV só pela Alexa heheh,2021-07-02 00:00:00
positivo,Alexa é sensacional É uma central de som inteligente e muita rápida nas respostas Muito fácil de ser instalada e toca todas as plataformas de músicas Apple Music Amazon music Spotify É interativa Fantástica Já presentes mais 3 pessoas com a Alexa 4a geração,2021-06-09 00:00:00
positivo,Atendeu as minhas espectativas Excelente qualidade do produto e som bem auto Porém com 2 ressalvas Ela não reconhece sempre a minha voz principalmente quando ela está me respondendo e ela pareada com o fire tv da umas interferências no som após um período longo de uso dando uns atrasos ou umas falhas no som,2021-05-20 00:00:00
positivo,Produto muito bom Um assiste incrível Só uma coisa que não gostei Ela não abre aplicativos como YouTube ou Netflix na minha smart Tv mesmo tendo Alexa integrada sendo que pelo controle da tv ela abre os app Mas infelizmente essa echo Dot não abre os app.fora isso eu Recomendo,2021-12-01 00:00:00
positivo,Prático Mas:(a Precisa de alguém que tenha conhecimentos aprimorados de computação para a instalação;(b Não responde a todas as perguntas P exemplo não soube responder quem são os melhores escritores brasileiros;(c)alguns canais de televisão precisam ser re-instalados,2021-07-26 00:00:00
positivo,Amei Alexa Echo Dot é simples amiga e eficiente!!Reconhece a voz de toda a família acessa a minha agenda e avisa os compromissos faz minha lista de compras a qualidade do som é ótima Me acorda com minha música favorita Amamos sua inteligência artificial,2021-04-29 00:00:00
positivo,Gostei muito do aparelho Tem um som bem limpo e de certa forma alto pelo menos para mim As vezes preciso falar duas vezes para ela ouvir Não sou de falar alto Enfim de um modo geral o aparelho me agradou muito e cumpre o que realmente se propõe a fazer,2021-03-13 00:00:00
positivo,Ainda estou conhecendo a echo dot mas estou bem satisfeita precisa ficar ligada na tomada já que não possui bateria A configuração dela é bem simples qdo se compra direto pela Amazon Aguardando chegar os outros produtos para adaptar a ela os comandos,2021-11-22 00:00:00
positivo,A alexa é uma farra no começo no começo é uma farra mas depois vai perdendo um pouco da graça Ponto forte pode ler seus livros do kindle mas sempre o último aberto não consegui mudar de livro atráves do reconhecimento de voz Também tive dificuldade de conectar minha TV,2021-10-11 00:00:00
positivo,Comprei com receio de ter o problema de surdez deste modelo mas me surpreendi Acionamento por voz funciona perfeitamente e o som reproduzido é excelente pelo tamanho,2021-07-01 00:00:00
positivo,excelente produto superou as expectativas reconhece a voz até do meu filho de 3 anos não apresentou nenhum problema até agora levo para outros lugares e funciona perfeitamente utilizo somente para conexão ao spotfy e algumas noticias ainda não configurei para funcionamento da casa,2021-02-09 00:00:00
positivo,O som da Echo Dot 4ª Geração é incrível instalação muito fácil Aos que estão tendo problemas com reconhecimento de voz ou precisam chegar perto para ela escutar experimentem o comando Alexa Atualização leva cerca de 30 minutos e o reconhecimento de voz fica 100 melhor,2021-12-26 00:00:00
positivo,Esperava mais Alexa é surda tem falar alto pra ela entender som esperava mais com volume baixo tem um gostoso grave passa do 5 cai a qualidade os graves somem e distorce Para ouvir música ambiente mesmo e sem ninguém falando kkkkk,2021-08-02 00:00:00
positivo,Gostamos bastante do produto apenas não ficamos muito felizes com 2 detalhes a cor do cabo é diferente da cor do aparelho comprei produto preto e o cabo veio branco poderia ser igual Também seria melhor se funcionasse a bateria sem precisar ficar na tomada,2021-07-22 00:00:00
negativo,comprei esse modelo 4ª geração como primeira Alexa e comprei uma segunda 3ª geração utilizo elas diariamente uma no cozinha outra no meu home office e na minha opinião a 3ª geração é melhor em qualidade de microfone e compreensão de voz volume das duas são iguais,2022-02-12 00:00:00
positivo,Desde que comprei a Alexa eu tenho usado ela pra tudo desde tocar música até como agenda e despertador Às vezes ela é meio surdinha kkkkkk mas nada que seja um problema,2021-09-21 00:00:00
positivo,Em comparação ao modelo antigo a melhora no som é pouco percebível por outro lado a piora no microfone é gritante Caso precise de um aparelho que tenha alcance de compreensão de voz melhor recomendo a versão antiga O echo andou pra trás dessa vez,2021-07-01 00:00:00
